{
  "apiVersion": "herdforge.dev/v1alpha1",
  "kind": "AgentScope",
  "metadata": {
    "id": "scope-SPE-566",
    "runId": "run-SPE-566-1",
    "phaseId": "phase-SPE-566-implement",
    "task": "SPE-566",
    "issuedAt": "2026-08-03T12:00:00Z",
    "expiresAt": "2026-08-03T13:00:00Z"
  },
  "spec": {
    "subject": {
      "agentId": "pi-worker-1",
      "sessionId": "session-SPE-566-1",
      "lane": "foundation"
    },
    "repository": {
      "identity": "github.com/Kampe/Herdforge",
      "baseSha": "1111111111111111111111111111111111111111",
      "headSha": "2222222222222222222222222222222222222222"
    },
    "worktree": {
      "identity": "worktree-SPE-566",
      "path": ".worktrees/SPE-566-agentscope-contract",
      "repositoryRoot": ".",
      "mutable": true,
      "shared": false
    },
    "paths": {
      "readable": [
        "go.mod",
        "pkg/agentscope",
        "contracts/agentscope/v1alpha1"
      ],
      "writable": [
        "pkg/agentscope",
        "contracts/agentscope/v1alpha1"
      ]
    },
    "commandProfiles": ["go-test", "git-commit"],
    "network": {
      "mode": "allowlist",
      "allowedHosts": ["api.openai.com"]
    },
    "git": {
      "actions": ["status", "diff", "add", "commit", "push", "create_pr"]
    },
    "credentials": [
      {
        "ref": "pi-openai-SPE-566",
        "provider": "openai",
        "scopes": ["inference"],
        "expiresAt": "2026-08-03T12:45:00Z"
      }
    ],
    "runtime": {
      "provider": "openai",
      "model": "gpt-5.6-luna",
      "deadlineSeconds": 1800,
      "maxTurns": 24,
      "maxTokens": 120000,
      "stallTimeoutSeconds": 180,
      "loopWindow": 12,
      "loopRepeatThreshold": 3,
      "maxPaidUsd": 8
    },
    "evidence": {
      "kinds": ["test", "lint", "diff", "receipt"],
      "prefix": ".herd/evidence/SPE-566",
      "maxBytes": 1048576
    },
    "grants": {
      "kubernetes": false,
      "unrestrictedShell": false,
      "extensions": []
    }
  }
}
